{
  "cir_version": "sg_v7_cir_v1",
  "contract_version": "sg_v7_contract_v1",
  "sample_id": "stop_near_marked_object_then_first_described_action__base__s10421__c09bd123",
  "source_variant_key": "base",
  "pattern_name": "stop_near_marked_object_then_first_described_action",
  "difficulty_bucket": "hard",
  "complexity_class": "M",
  "graph_seed": 10421,
  "scene_graph": {
    "actors": [
      {
        "id": "actor_1",
        "type": "human",
        "labels": {
          "ordinal": "first"
        }
      },
      {
        "id": "actor_2",
        "type": "human",
        "labels": {
          "ordinal": "second"
        }
      }
    ],
    "objects": [
      {
        "id": "object_marked_a1b2c3d4",
        "type": "generic",
        "name": "laptop",
        "relative_position": "unknown",
        "marker_binding": {
          "kind": "marked",
          "marker_short_id": "a1b2c3d4",
          "source_name": "laptop",
          "mentioned_aliases": [
            "laptop",
            "notebook",
            "pc"
          ]
        }
      }
    ],
    "beats": [
      {
        "id": "beat_1",
        "phase": "toward_each_other",
        "actions": [
          {
            "id": "action_1",
            "actor_id": "actor_1",
            "type": "walk",
            "target_id": "actor_2",
            "direction": "toward_each_other",
            "resulting_pose": "walking",
            "semantics": {
              "chronology_rank": 1
            }
          },
          {
            "id": "action_2",
            "actor_id": "actor_2",
            "type": "walk",
            "target_id": "actor_1",
            "direction": "toward_each_other",
            "resulting_pose": "walking",
            "semantics": {
              "chronology_rank": 2
            }
          }
        ]
      },
      {
        "id": "beat_2",
        "phase": "stop_near_object",
        "actions": [
          {
            "id": "action_3",
            "actor_id": "actor_1",
            "type": "stop",
            "target_id": "object_marked_a1b2c3d4",
            "resulting_pose": "standing",
            "semantics": {
              "chronology_rank": 3
            }
          },
          {
            "id": "action_4",
            "actor_id": "actor_2",
            "type": "stop",
            "target_id": "object_marked_a1b2c3d4",
            "resulting_pose": "standing",
            "semantics": {
              "chronology_rank": 4
            }
          }
        ]
      },
      {
        "id": "beat_3",
        "phase": "first_described_action",
        "actions": [
          {
            "id": "action_5",
            "actor_id": "actor_1",
            "type": "described_action",
            "resulting_pose": "standing",
            "described_action": {
              "canonical_text": "starts smoking",
              "fallback_text": "*starts smoking*",
              "source_lemma_hint": "smoke"
            },
            "semantics": {
              "is_unsupported_runtime_action": true,
              "must_preserve_in_source": true,
              "chronology_rank": 5
            }
          }
        ]
      }
    ],
    "spatial_relations": [
      {
        "id": "rel_1",
        "subject": "actor_1",
        "relation": "near",
        "object": "object_marked_a1b2c3d4"
      },
      {
        "id": "rel_2",
        "subject": "actor_2",
        "relation": "near",
        "object": "object_marked_a1b2c3d4"
      }
    ],
    "reference_bindings": {
      "ordinal_map": {
        "first": "actor_1",
        "second": "actor_2"
      },
      "marked_object_ids": [
        "object_marked_a1b2c3d4"
      ],
      "alias_to_object_id": {
        "laptop": "object_marked_a1b2c3d4",
        "pc": "object_marked_a1b2c3d4"
      }
    },
    "must_preserve": [
      "beat_count=3",
      "must_ground_object:object_marked_a1b2c3d4",
      "ordinal:first->actor_1",
      "action:action_5=described_action"
    ]
  },
  "semantic_tags": [
    "movement",
    "marked_object",
    "ordinal_reference",
    "described_action",
    "multi_beat"
  ],
  "determinism": {
    "id_policy": "canonical_v1",
    "ordering_policy": "stable_v1",
    "serializer": "deterministic_scene_script_v1",
    "phase_policy": "phase_enum_v1",
    "described_action_policy": "described_action_v1"
  },
  "budgets": {
    "actor_count": 2,
    "object_count": 1,
    "beat_count": 3,
    "action_count": 5,
    "relation_count": 2
  },
  "runtime_projection": {
    "target_schema": "SceneScript",
    "field_casing": "camelCase",
    "drop_internal_fields": true,
    "fill_original_description_from_source_variant": true,
    "described_action_source_text_policy": "canonical_text_to_sourceText",
    "top_level_optional_policy": "omit_all",
    "beat_optional_policy": "preserve_if_present_else_omit"
  }
}
